{
  "schema": "schema://frank.ad-template-generator-release/v1",
  "tool_id": "ad-template-generator",
  "scope": {"kind": "project", "id": "blockwise"},
  "release_version": "1.0.0",
  "release_id": "release-1",
  "status": "released",
  "settings_revision": 1,
  "settings_ref": "hermes://settings/revision-1",
  "pipeline_id": "reference-clone-release",
  "pipeline_version": "1.0.0",
  "consumer_compatibility": ["blockwise-template-pack-v1"],
  "template_pack": {
    "schema": "blockwise.template-pack/v1",
    "pack_id": "pack-golden-001-v1",
    "artifact_ref": "https://frank.fail/releases/pack-golden-001-v1.json",
    "sha256": "bbbbbbbbbbbbbbbbbbbbbbbbbbbbbbbbbbbbbbbbbbbbbbbbbbbbbbbbbbbbbbbb",
    "signature_algorithm": "ed25519",
    "signature": "base64-ed25519-signature-placeholder"
  },
  "provenance": {
    "artifact_ref": "https://frank.fail/releases/pack-golden-001-v1.json",
    "artifact_receipt_ref": "hermes://receipts/artifact-1"
  },
  "trace_ref": "hermes://traces/run-1",
  "qa_receipt": {"decision": "pass", "receipt_ref": "hermes://receipts/qa-1", "checked_at": "2026-08-14T00:00:00Z"},
  "approval_receipt": {"decision": "approved", "gate": "native-pixel-human-approval", "receipt_ref": "hermes://receipts/approval-1", "decided_at": "2026-08-14T00:01:00Z"},
  "sanitization_receipt": {"decision": "pass", "receipt_ref": "hermes://receipts/sanitization-1", "checked_at": "2026-08-14T00:02:00Z"},
  "released_at": "2026-08-14T00:03:00Z",
  "release_hash": "793f20dee498be21c417a55e6a8822368359985e13b55abb06f6da82b8c9100f",
  "immutable": true,
  "source_free": true
}
